{
  "event_id": "550e8400-e29b-41d4-a716-446655440010",
  "correlation_id": "550e8400-e29b-41d4-a716-446655440011",
  "session_id": "550e8400-e29b-41d4-a716-446655440012",
  "player_id": "550e8400-e29b-41d4-a716-446655440013",
  "event_type": "economy.trade.execute",
  "source": "economy.trading",
  "timestamp": "2025-12-20T15:45:30Z",
  "version": "1.0.0",
  "data": {
    "trade_id": "550e8400-e29b-41d4-a716-446655440200",
    "listing_id": "550e8400-e29b-41d4-a716-446655440201",
    "buyer_id": "550e8400-e29b-41d4-a716-446655440013",
    "seller_id": "550e8400-e29b-41d4-a716-446655440014",
    "item_id": "550e8400-e29b-41d4-a716-446655440202",
    "item_type": "weapon",
    "quantity": 1,
    "price": 25000,
    "currency": "eurodollars",
    "total_amount": 25000,
    "fee_amount": 1250,
    "executed_at": "2025-12-20T15:45:30Z",
    "location": "night_city_market",
    "payment_method": "instant"
  },
  "metadata": {
    "priority": "normal",
    "ttl": "30d",
    "retry_count": 0
  }
}
