{
  "event_id": "550e8400-e29b-41d4-a716-446655440000",
  "correlation_id": "550e8400-e29b-41d4-a716-446655440001",
  "session_id": "550e8400-e29b-41d4-a716-446655440002",
  "player_id": "550e8400-e29b-41d4-a716-446655440003",
  "event_type": "combat.session.start",
  "source": "combat.session",
  "timestamp": "2025-12-20T14:30:00Z",
  "version": "1.0.0",
  "data": {
    "combat_id": "550e8400-e29b-41d4-a716-446655440100",
    "combat_type": "pvp",
    "participants": [
      {
        "player_id": "550e8400-e29b-41d4-a716-446655440003",
        "character_id": "550e8400-e29b-41d4-a716-446655440004",
        "team": "alpha",
        "role": "leader",
        "join_time": "2025-12-20T14:30:00Z"
      },
      {
        "player_id": "550e8400-e29b-41d4-a716-446655440005",
        "character_id": "550e8400-e29b-41d4-a716-446655440006",
        "team": "bravo",
        "role": "member",
        "join_time": "2025-12-20T14:30:00Z"
      }
    ],
    "location": {
      "x": 123.45,
      "y": 67.89,
      "z": 0.0
    },
    "zone_id": "night_city_combat_zone_01",
    "difficulty": "normal",
    "max_duration_seconds": 1800,
    "rules": {
      "allow_respawn": true,
      "friendly_fire": false,
      "time_limit": 1800,
      "max_participants": 10,
      "victory_conditions": ["eliminate_all"]
    }
  },
  "metadata": {
    "priority": "high",
    "ttl": "7d",
    "retry_count": 0
  }
}
