{
  "event_id": "550e8400-e29b-41d4-a716-446655440000",
  "event_type": "crafting.session.start",
  "timestamp": "2025-12-20T14:30:00Z",
  "version": "1.0.0",
  "source": "crafting.network",
  "correlation_id": "550e8400-e29b-41d4-a716-446655440001",
  "session_id": "550e8400-e29b-41d4-a716-446655440002",
  "player_id": "550e8400-e29b-41d4-a716-446655440003",
  "data": {
    "session_id": "550e8400-e29b-41d4-a716-446655440002",
    "recipe_id": "550e8400-e29b-41d4-a716-446655440004",
    "player_id": "550e8400-e29b-41d4-a716-446655440003",
    "materials": [
      {
        "material_id": "550e8400-e29b-41d4-a716-446655440005",
        "quantity": 5,
        "quality": "common"
      },
      {
        "material_id": "550e8400-e29b-41d4-a716-446655440006",
        "quantity": 3,
        "quality": "uncommon"
      }
    ],
    "estimated_duration_seconds": 300,
    "workstation_id": "550e8400-e29b-41d4-a716-446655440007",
    "location": {
      "x": 123.45,
      "y": 67.89,
      "z": 0.0
    },
    "zone_id": "night_city_crafting_zone_01"
  },
  "metadata": {
    "priority": "normal",
    "ttl": "7d",
    "retry_count": 0,
    "compression": "snappy"
  }
}
